{
  "$schema": "https://json-schema.org/draft/2020-12/schema",
  "$id": "https://docs.oasis-open.org/ubl/2/json/schemas/UBL-OrderCancellation-2",
  "description": "A document used to cancel an entire Order.",
  "type": "object",
  "properties": {
    "UBLEntity": {
      "const": "https://docs.oasis-open.org/ubl/2/json/schemas/UBL-OrderCancellation-2",
      "description": "Identifies the JSON schema governing this instance."
    },
    "UBLExtensions": {
      "$ref": "https://docs.oasis-open.org/ubl/2/json/schemas/CommonExtensionComponents-2#/$defs/UBLExtensionsType"
    },
    "Signature": {
      "oneOf": [
        {
          "$ref": "https://docs.oasis-open.org/ubl/2/json/schemas/CommonAggregateComponents-2#/$defs/SignatureType"
        },
        {
          "type": "array",
          "items": {
            "$ref": "https://docs.oasis-open.org/ubl/2/json/schemas/CommonAggregateComponents-2#/$defs/SignatureType"
          },
          "minItems": 1
        }
      ]
    },
    "UBLVersionID": {
      "$ref": "https://docs.oasis-open.org/ubl/2/json/schemas/CommonBasicComponents-2#/$defs/UBLVersionID"
    },
    "CustomizationID": {
      "$ref": "https://docs.oasis-open.org/ubl/2/json/schemas/CommonBasicComponents-2#/$defs/CustomizationID"
    },
    "ProfileID": {
      "$ref": "https://docs.oasis-open.org/ubl/2/json/schemas/CommonBasicComponents-2#/$defs/ProfileID"
    },
    "ProfileExecutionID": {
      "$ref": "https://docs.oasis-open.org/ubl/2/json/schemas/CommonBasicComponents-2#/$defs/ProfileExecutionID"
    },
    "ID": {
      "$ref": "https://docs.oasis-open.org/ubl/2/json/schemas/CommonBasicComponents-2#/$defs/ID"
    },
    "UUID": {
      "$ref": "https://docs.oasis-open.org/ubl/2/json/schemas/CommonBasicComponents-2#/$defs/UUID"
    },
    "IssueDate": {
      "$ref": "https://docs.oasis-open.org/ubl/2/json/schemas/CommonBasicComponents-2#/$defs/IssueDate"
    },
    "IssueTime": {
      "$ref": "https://docs.oasis-open.org/ubl/2/json/schemas/CommonBasicComponents-2#/$defs/IssueTime"
    },
    "Note": {
      "oneOf": [
        {
          "$ref": "https://docs.oasis-open.org/ubl/2/json/schemas/CommonBasicComponents-2#/$defs/Note"
        },
        {
          "type": "array",
          "items": {
            "$ref": "https://docs.oasis-open.org/ubl/2/json/schemas/CommonBasicComponents-2#/$defs/Note"
          },
          "minItems": 1
        }
      ]
    },
    "CancellationNote": {
      "oneOf": [
        {
          "$ref": "https://docs.oasis-open.org/ubl/2/json/schemas/CommonBasicComponents-2#/$defs/CancellationNote"
        },
        {
          "type": "array",
          "items": {
            "$ref": "https://docs.oasis-open.org/ubl/2/json/schemas/CommonBasicComponents-2#/$defs/CancellationNote"
          },
          "minItems": 1
        }
      ]
    },
    "OrderReference": {
      "oneOf": [
        {
          "$ref": "https://docs.oasis-open.org/ubl/2/json/schemas/CommonAggregateComponents-2#/$defs/OrderReferenceType"
        },
        {
          "type": "array",
          "items": {
            "$ref": "https://docs.oasis-open.org/ubl/2/json/schemas/CommonAggregateComponents-2#/$defs/OrderReferenceType"
          },
          "minItems": 1
        }
      ]
    },
    "OriginatorDocumentReference": {
      "$ref": "https://docs.oasis-open.org/ubl/2/json/schemas/CommonAggregateComponents-2#/$defs/DocumentReferenceType"
    },
    "AdditionalDocumentReference": {
      "oneOf": [
        {
          "$ref": "https://docs.oasis-open.org/ubl/2/json/schemas/CommonAggregateComponents-2#/$defs/DocumentReferenceType"
        },
        {
          "type": "array",
          "items": {
            "$ref": "https://docs.oasis-open.org/ubl/2/json/schemas/CommonAggregateComponents-2#/$defs/DocumentReferenceType"
          },
          "minItems": 1
        }
      ]
    },
    "Contract": {
      "oneOf": [
        {
          "$ref": "https://docs.oasis-open.org/ubl/2/json/schemas/CommonAggregateComponents-2#/$defs/ContractType"
        },
        {
          "type": "array",
          "items": {
            "$ref": "https://docs.oasis-open.org/ubl/2/json/schemas/CommonAggregateComponents-2#/$defs/ContractType"
          },
          "minItems": 1
        }
      ]
    },
    "BuyerCustomerParty": {
      "$ref": "https://docs.oasis-open.org/ubl/2/json/schemas/CommonAggregateComponents-2#/$defs/CustomerPartyType"
    },
    "SellerSupplierParty": {
      "$ref": "https://docs.oasis-open.org/ubl/2/json/schemas/CommonAggregateComponents-2#/$defs/SupplierPartyType"
    },
    "OriginatorCustomerParty": {
      "$ref": "https://docs.oasis-open.org/ubl/2/json/schemas/CommonAggregateComponents-2#/$defs/CustomerPartyType"
    },
    "BeneficiaryParty": {
      "oneOf": [
        {
          "$ref": "https://docs.oasis-open.org/ubl/2/json/schemas/CommonAggregateComponents-2#/$defs/PartyType"
        },
        {
          "type": "array",
          "items": {
            "$ref": "https://docs.oasis-open.org/ubl/2/json/schemas/CommonAggregateComponents-2#/$defs/PartyType"
          },
          "minItems": 1
        }
      ]
    }
  },
  "required": [
    "UBLEntity",
    "ID",
    "IssueDate",
    "CancellationNote",
    "OrderReference",
    "BuyerCustomerParty",
    "SellerSupplierParty"
  ],
  "additionalProperties": false,
  "minProperties": 1,
  "title": "Order Cancellation. Details"
}
