{
  "UBLEntity": "https://docs.oasis-open.org/ubl/2/json/schemas/UBL-OrderCancellation-2",
  "UBLVersionID": "2.1",
  "CustomizationID": "urn:www.cenbii.eu:transaction:biicoretrdmXYZ:ver1.0",
  "ProfileID": {
    "value": "urn:www.cenbii.eu:profile:BIIXYZ:ver1.0",
    "schemeID": "BII:Profile"
  },
  "ID": "7",
  "IssueDate": "2010-01-21",
  "IssueTime": "12:30:00Z",
  "CancellationNote": "With reference to phone call",
  "OrderReference": {
    "ID": "34"
  },
  "BuyerCustomerParty": {
    "Party": {
      "PartyIdentification": [
        {
          "ID": {
            "value": "7300070011115",
            "schemeID": "9:GLN"
          }
        },
        {
          "ID": "PartyID123"
        }
      ],
      "PartyName": {
        "Name": "Johnssons byggvaror"
      }
    }
  },
  "SellerSupplierParty": {
    "Party": {
      "PartyIdentification": {
        "ID": "SellerPartyID123"
      },
      "PartyName": {
        "Name": "Moderna Produkter AB"
      }
    }
  }
}
